{"adapter_policy":{"schema":"agentguard.verifier-projection-policy","schema_version":1,"sha256":"59f2f50505ae2ada72c2a30e6bacaa2d40e04a810ea220c474d5a46a5369196e"},"conflicts":[],"event_mappings":[{"projected_event_id":"agentguard:1:9c6853b6b36f3f859fd585ad5d326d96f864ce9d2c00fc1f42f96a8da7527466","rule_id":"execution-started-v1","source_event_hash":"9c6853b6b36f3f859fd585ad5d326d96f864ce9d2c00fc1f42f96a8da7527466","source_sequence":1},{"projected_event_id":"agentguard:2:f1d08dd82f8342e12411600a76995b0dc65dd559a157552c90a5efcffe9678e9","rule_id":"agent-command-v1","source_event_hash":"f1d08dd82f8342e12411600a76995b0dc65dd559a157552c90a5efcffe9678e9","source_sequence":2},{"projected_event_id":"agentguard:3:081a721b2f40419b8af7b506925de48467003dd8ac08e74a57d4da58582b4751","rule_id":"file-change-v1","source_event_hash":"081a721b2f40419b8af7b506925de48467003dd8ac08e74a57d4da58582b4751","source_sequence":3},{"projected_event_id":"agentguard:4:811eb4e131594eeb7a4188c364e8cfc8237aa2609a287ddc6b1d616756950cc2","rule_id":"test-result-v1","source_event_hash":"811eb4e131594eeb7a4188c364e8cfc8237aa2609a287ddc6b1d616756950cc2","source_sequence":4},{"projected_event_id":"agentguard:5:67254b4a4c46129a851536b0ab7808bfa4d210cc03176baf6638f8e4ba8181f7","rule_id":"check-result-v1","source_event_hash":"67254b4a4c46129a851536b0ab7808bfa4d210cc03176baf6638f8e4ba8181f7","source_sequence":5},{"projected_event_id":"agentguard:6:ccbb42fb1a2879217f538ce78259682ef30f0c6fd53088c079ce11a3e2826e53","rule_id":"execution-completed-v1","source_event_hash":"ccbb42fb1a2879217f538ce78259682ef30f0c6fd53088c079ce11a3e2826e53","source_sequence":6}],"missing_inputs":[],"projection":{"sha256":"cf4087bb8dd196e0d61fe25aea59ad3e4322d16cd4a15c56009bbd000ba5330b"},"projection_contract":"bonfyre.agent_trace.v1","schema":"agentguard.verifier-projection-report","schema_version":1,"source_trace":{"final_event_hash":"ccbb42fb1a2879217f538ce78259682ef30f0c6fd53088c079ce11a3e2826e53","root_hash":"d67587b4ca4b71994edb8d5d2b191a062cba0ad9dd3773f0e6d2fa4af6336491","sha256":"ba46acb07c5c5d98575050a7959aab396a8468fa654f656d89e63713b1263b2a","trace_id":"d67587b4ca4b71994edb8d5d2b191a062cba0ad9dd3773f0e6d2fa4af6336491"},"status":"complete","unverifiable":[]}
