{"adapter_policy":{"schema":"agentguard.verifier-projection-policy","schema_version":1,"sha256":"5762e456fcb085f8e5f5c395d6a451c8ebb3baa2e35e1aa27ff56fcf86f412e5"},"conflicts":[],"event_mappings":[{"projected_event_id":"agentguard:1:7e9c558c728c5f36bdf4552c90ec6c62d2e03d618bbbc70cb22af36519ec6f17","rule_id":"execution-started-v1","source_event_hash":"7e9c558c728c5f36bdf4552c90ec6c62d2e03d618bbbc70cb22af36519ec6f17","source_sequence":1},{"projected_event_id":"agentguard:2:ffadca15fa3ad20f9013462bcb953809d647e5274b10fa0c0c51c1dc8a8727b7","rule_id":"agent-command-v1","source_event_hash":"ffadca15fa3ad20f9013462bcb953809d647e5274b10fa0c0c51c1dc8a8727b7","source_sequence":2},{"projected_event_id":"agentguard:3:d71610aec28e0ce39449e198e70abc817a20bdd1be1be4dab47435b0208fc780","rule_id":"file-change-v1","source_event_hash":"d71610aec28e0ce39449e198e70abc817a20bdd1be1be4dab47435b0208fc780","source_sequence":3},{"projected_event_id":"agentguard:4:0ba3fe31206dbacca0376dfcf534bed5c5b5e57cc5fa4234dc759c428f94949c","rule_id":"test-result-v1","source_event_hash":"0ba3fe31206dbacca0376dfcf534bed5c5b5e57cc5fa4234dc759c428f94949c","source_sequence":4},{"projected_event_id":"agentguard:5:c937fe7aa16a5f90c0ba7e5d2ab96ef58d08b17abdf69fea2f76626b7510e2cd","rule_id":"check-result-v1","source_event_hash":"c937fe7aa16a5f90c0ba7e5d2ab96ef58d08b17abdf69fea2f76626b7510e2cd","source_sequence":5},{"projected_event_id":"agentguard:6:e337bc447444211b2887f2b44c1770f87291a44a558136178f8d0a6eff9dab23","rule_id":"execution-completed-v1","source_event_hash":"e337bc447444211b2887f2b44c1770f87291a44a558136178f8d0a6eff9dab23","source_sequence":6}],"missing_inputs":[],"projection":{"sha256":"4594a1610112ccb313dc9c7ba4da65a8370cead1524de616bb660b5760760591"},"projection_contract":"bonfyre.agent_trace.v1","schema":"agentguard.verifier-projection-report","schema_version":1,"source_trace":{"final_event_hash":"e337bc447444211b2887f2b44c1770f87291a44a558136178f8d0a6eff9dab23","root_hash":"9fa22c7022dfa8b1c80e4c1d70acc903306ea04736062c3796aa418ce3eef544","sha256":"736813a8c050cb524dbbd3e3b8d673fae4bfdb674975c6f9a68dbcc614b8311a","trace_id":"9fa22c7022dfa8b1c80e4c1d70acc903306ea04736062c3796aa418ce3eef544"},"status":"complete","unverifiable":[]}
